"Authors","Author full names","Author(s) ID","Title","Year","Cited by","DOI","Link","Abstract","Author Keywords","Index Keywords"
"Anderson J.P.","Anderson, James P. (56137308100)","56137308100","Information Security in a Multi-User Computer Environment","1972","25","10.1016/S0065-2458(08)60506-9","https://www.scopus.com/inward/record.uri?eid=2-s2.0-77956859736&doi=10.1016%2fS0065-2458%2808%2960506-9&partnerID=40&md5=d96b884fe45c9933916324a3ed40754c","The problem of “computer security” ranges from physical protection of computer equipment to the physical and logical protection of computer-based data. As the techniques of physical security are well known and simple to apply, this chapter stresses on the problems and prospects for protecting data or information in multi-user computer environments. The emphasis is on the threats inherent in programming and using a system rather than various forms of internal and external penetration of the “smash-and-grab” variety, or the subversion of employees having legitimate access to a system. Not discussed at any length are the topics of administrative controls, physical security techniques, personnel screening, and many other aspects of security that are required in greater or lesser degree to devise a secure system. One is often confronted with the question: Is it possible to build a completely secure system? The answer must be unqualifiedly negative. However, it is possible to build an adequately secure system for a particular operational environment. The chapter shows that there is no single set of measures that can be taken to obtain “instant security.” Information security is a problem of providing sufficient barriers and controls to force a prospective penetrator into attacks that carry a high risk of detection and/or have a very large work factor. The work factor, if high enough, will be sufficient to deter all but the most dedicated penetrator, and for him it may make any eventual success a hollow victory. © 1972, Academic Press Inc.","",""
"Evans M.","Evans, Mike (55727618500)","55727618500","Security advances in banking systems","1985","0","10.1016/0011-684X(85)90136-4","https://www.scopus.com/inward/record.uri?eid=2-s2.0-46549090470&doi=10.1016%2f0011-684X%2885%2990136-4&partnerID=40&md5=d73a324f6d673fab6bdfb3d04bab4848","In retail and international banking, there is a growing demand for upto-date information. Security is an important factor in all aspects of bank work. © 1985.","banking; computer networks; data processing",""
"Wood C.C.; Zeidler H.M.","Wood, Charles Cresson (57210508279); Zeidler, Howard M. (7101647420)","57210508279; 7101647420","Security modules: Potent information security system components","1986","1","10.1016/0167-4048(86)90133-1","https://www.scopus.com/inward/record.uri?eid=2-s2.0-0022736093&doi=10.1016%2f0167-4048%2886%2990133-1&partnerID=40&md5=6d6b37c96eb18b19a1d63456872714bd","In the future, the security of computer and data communications systems will to a large extent depend on the secure handling of secret parameters. Such parameters include log-on passwords, Personal Identification Numbers(PINs), encryption keys, encryption Initialization Vectors (IVs), pseudo-random number-generator quantities, and biometric personal identification quantities like digitized fingerprints. The greater dependency on such security parameters will be the natural outgrowth of both the increasing sophistication and the increasing computerization of security functions. A new approach to protected storage and protected processing of security parameters is the use of a special type of hardware/firmware-based equipment variously referred to as security modules, tamper-resistant modules, and cryptographic security modules. This paper describes representative functions that security modules perform, the benefits to be derived when security modules are deployed, and some current and future applications of this new technology. © 1986.","cryptographic security module; Security module; tamper-resistant module","CRYPTOGRAPHY; SECURE STORAGE; SECURITY MODULE; SOFTWARE PROTECTION; TAMPER-RESISTANT MODULE; DATA PROCESSING"
"McEvers J.A.; Krichinsky A.M.; Layman L.R.; Dunnigan T.H.; Tuft R.M.; Murray W.P.","McEvers, J.A. (6507881813); Krichinsky, A.M. (6508056431); Layman, L.R. (7006639140); Dunnigan, T.H. (57188754899); Tuft, R.M. (7004543305); Murray, W.P. (7201983366)","6507881813; 6508056431; 7006639140; 57188754899; 7004543305; 7201983366","IMPLEMENTATION OF THE FACILITY-INTEGRATED COMPUTER SYSTEM (FICS) FOR NUCLEAR MATERIAL ACCOUNTABILITY.","1980","0","","https://www.scopus.com/inward/record.uri?eid=2-s2.0-0019091496&partnerID=40&md5=e37ff59e126ed16ea31f975c8ce6f012","A computer system that has been developed for nuclear material accountability and has been operating in an active radiochemical processing plant involving remote operations is described. The FICS was developed (1) to provide improved nuclear material accountability and control and (2) to provide information security. The system has become part of ORNL's Engineering Safeguard Program which has the objective of demonstrating process monitoring as it might be accomplished by inspectors of a nuclear fuel recycle facility.","","Chemical plants; Computers; RADIOCHEMISTRY; Nuclear fuels"
"Tyra Neil W.; Miles Paul A.","Tyra, Neil W. (6507078193); Miles, Paul A. (7103155891)","6507078193; 7103155891","SYSTEMATIC METHOD FOR EVALUATING SECURITY REQUIREMENTS COMPLIANCE.","1985","0","","https://www.scopus.com/inward/record.uri?eid=2-s2.0-0022252679&partnerID=40&md5=8d76a57085647b8cf311de56b344cfe8","The authors introduce the security compliance analysis model (SCAM) as a tool for evaluating the degree of security requirement satisfaction. The model provides a means for compiling independently derived compliance evaluations over the broad spectrum of security issues: COMSEC, OPSEC, TEMPEST and Red/Black, ADPE security, physical security, information security, industrial security, and system security areas. The model relates these broad security issues to their constituent parameters (partitioning, shielding, isolation, separation, etc. ) via a hierarchical tree structure. Also provided is a means for assigning relational weighting factors that signify the parameter's relative significance to the overall security category. Finally, the model interprets compliance factors and proceeds through a mathematical algorithm to generate a series of scoring values that may be graphed over time.","","MILITARY COMMUNICATIONS - Space Applications; MILITARY ENGINEERING - Electronic Countermeasures; COMMAND AND CONTROL SYSTEMS; DATA SECURITY; DATA PROCESSING"
"Reitman R.P.; Andrews G.R.","Reitman, Richard P. (6602632313); Andrews, Gregory R. (7202160811)","6602632313; 7202160811","Certifying information flow properties of programs: An axiomatic approach","1979","6","10.1145/567752.567779","https://www.scopus.com/inward/record.uri?eid=2-s2.0-0018296488&doi=10.1145%2f567752.567779&partnerID=40&md5=0b8f8699e3f21561c1602351d7f917fc","Interesting program properties other than functional correctness can be addressed and proved using axiomatic logic. An information flow logic that defines the flow semantics of a parallel programming language is presented. Proofs in this logic can be used to certify programs with respect to information security policies. The flow logic can also be combined with correctness logics to form an even more powerful deductive system. © 1979 ACM.","Computer security; Concurrency; Information flow; Policy certification; Program validation; Proof rules; Synchronization","Parallel programming; Security of data; Security systems; Semantics; Synchronization; Computer programming; Axiomatic approach; Concurrency; Functional correctness; Information flows; Information security policies; Program properties; Program validation; Proof rules; COMPUTER SECURITY; INFORMATION FLOW LOGIC; Computer circuits; Computer metatheory"
"Anon","Anon (1)","1","CONFERENCE PROCEEDINGS - ELECTRONICS FOR NATIONAL SECURITY.","1983","0","","https://www.scopus.com/inward/record.uri?eid=2-s2.0-0020873013&partnerID=40&md5=b41e792bef0efb1e89f53281ffe7a9bc","This conference proceedings contains 43 papers, one in abstract form only. Various applications of electronics and computers in military and defense systems of the free world are considered. Military communications, acquisition and processing of military information, electron warfare (EW), electronic counter measures, command, control and communication intelligence (C3I) systems, rocket guidance systems, Doppler radar, combat vehicles, aircraft and weapons, naval ships and warfare, and security and protection schemes are discussed.","","AIRCRAFT, MILITARY - Electronic Equipment; MILITARY COMMUNICATION - Computer Interfaces; MILITARY VEHICLES - Control Systems; NAVAL WARFARE - Computer Applications; ROCKETS AND MISSILES - Guidance; COMMAND, CONTROL AND COMMUNICATION INTELLIGENCE (C3I) SYSTEMS; DOPPLER RADAR; EIREV; ELECTRONIC WARFARE (EW); MILITARY INFORMATION SECURITY; WEAPON SYSTEMS; ELECTRONIC EQUIPMENT"
"van Tongeren H.","van Tongeren, H. (6603956475)","6603956475","INFORMATION SECURITY IN THE FRAMEWORK OF THE INTERNATIONAL INFORMATION FLOW DEBATE - A BUSINESS VIEW.","1985","0","","https://www.scopus.com/inward/record.uri?eid=2-s2.0-0022301099&partnerID=40&md5=9f1e22ed8a527c58b960d03e07fcff73","Information Security is not only a technical, professional topic but also a societal issue. As such, it can be discussed as an important element of the International Information Flow debate and related to many of the issues raised in this debate. It has also become an issue in its own right. The international business community is involved in the discussions and has a clear position on the IIF issues in general as well as on the Information Security issue.","","COMPUTER SYSTEMS, DIGITAL - Security Systems; ECONOMIC ISSUES; INFORMATION SECURITY; INTERNATIONAL INFORMATION FLOW DEBATE; PRIVACY/DATA PROTECTION ISSUES; TELECOMMUNICATION ISSUES; DATA PROCESSING"
"Conley Robert E.","Conley, Robert E. (57197373875)","57197373875","INFORMATION PROTECTION.","1987","0","","https://www.scopus.com/inward/record.uri?eid=2-s2.0-0023536742&partnerID=40&md5=62ee35d9fff5674afa50fbafc30e691b","The subject of information security is discussed and several methods for protection of information are reviewed. Emphasis is placed on security methods to ensure that their application is consistent with management policy and intent.","","INFORMATION THEORY; INFORMATION ENTROPY; INFORMATION PROTECTION; DATA PROCESSING"
"Horn E.C.","Horn, Earl C. (56931551800)","56931551800","Three criteria for designing computing systems to facilitate debugging","1968","5","10.1145/363095.363145","https://www.scopus.com/inward/record.uri?eid=2-s2.0-84945014201&doi=10.1145%2f363095.363145&partnerID=40&md5=bce37568a4f9890a907be51b19db36e9","[No abstract available]","computer design; computer design criteria; computer systems; computer systems design; computing reliability; debugging; determinism; deterministic computers; information privacy; information security; input equipment; input equipment design; memory protection; multi processing; multiprocessing; multiprogrammed system design; multiprogrammed systems; multiprogramming; operating systems; operating systems design; parallel; parallel processing; parallel programming; program debugging; program semantics; program testing; programming; programming language design; programming language semantics; programming languages; protection; repeatability; reproducibility; virtual computers",""
"Matchett Noel D.","Matchett, Noel D. (6508138696)","6508138696","EXPLOITATION OF UNSECURED AND SECURED SYSTEMS AND WHAT CAN BE DONE ABOUT IT.","1987","0","","https://www.scopus.com/inward/record.uri?eid=2-s2.0-0023541939&partnerID=40&md5=ae9246252a4642ce7b23ee6341e2f265","The author addresses the problem of exploitation of unclassified and classified information. A discussion of present and future methods to provide the required security is presented.","","OFFICE AUTOMATION; TELECOMMUNICATION LINKS, MICROWAVE; TELECOMMUNICATION LINKS, SATELLITE; CLASSIFIED INFORMATION EXPLOITATION; INFORMATION SECURITY; SOVIET ESPIONAGE; DATA PROCESSING"
"Steele Robert W.","Steele, Robert W. (7402222584)","7402222584","SECURITY ISSUES FOR THE SENSITIVE, BUT UNCLASSIFIED, COMMUNITY.","1987","0","","https://www.scopus.com/inward/record.uri?eid=2-s2.0-0023561649&partnerID=40&md5=e9008299c3e600d37b3b2a62768cc5cc","Seven information security issues are addressed: the information explosion; the conflict between a free society and information security; defining sensitive information; industry concerns versus governmental concerns; the market for security technology; the cost of such technology; and the drivers behind expanded application of information security in the sensitive, but unclassified, community of users.","","INFORMATION SECURITY; INFOSEC; SENSITIVE INFORMATION; DATA PROCESSING"
"Reitman Richard P.","Reitman, Richard P. (6602632313)","6602632313","MECHANISM FOR INFORMATION CONTROL IN PARALLEL SYSTEMS.","1979","0","","https://www.scopus.com/inward/record.uri?eid=2-s2.0-0018660918&partnerID=40&md5=5556b642762892981706e0fe6bc80a5d","P. J. Denning and D. E. Denning have shown how the information security of sequential programs can be certified by a compile-time mechanism. This paper extends their work by presenting a mechanism for certifying parallel programs. The mechanism is shown to be consistent with an axiomatic description of information transmission.","","Data processing"
"Koch H.P.","Koch, H.P. (58458159900)","58458159900","Security in electronic data processing; [SICHERHEIT IN DER EDV. ERFAHRUNGSBERICHT EINES LANGJAHRIGEN EDV ANWENDERS]","1975","0","","https://www.scopus.com/inward/record.uri?eid=2-s2.0-0016830236&partnerID=40&md5=b919e1381d1ff2cd260bcb1d93a15abc","Making electronic data safe involves the securing of data processing machines against mistakes, destruction or misuse, and of the data against destruction, falsification and access by unauthorized persons. It comprises the total sum of of all technical, constructional, program technical and organisational measures against mistakes and destruction of the processing machines, against mistakes and abuses during information processing as well as against destruction, loss or falsification of the information. Security measures are therefore required against human error, against defects in the processing machines, against fire, water and explosions as well as against actions by unauthorized persons (destruction, falsification, eradication, unauthorized access to information). Damage usually leads to material or financial loss.","","computer; computer analysis; information system; professional secrecy"
"Andreassen A.L.; Leighton W.J., III; Schreiber D.F.","Andreassen, Alf L. (7003864172); Leighton, William J. (6701653920); Schreiber, David F. (7103248822)","7003864172; 6701653920; 7103248822","Information Security: An Overview","1988","1","10.1002/j.1538-7305.1988.tb00625.x","https://www.scopus.com/inward/record.uri?eid=2-s2.0-0024279947&doi=10.1002%2fj.1538-7305.1988.tb00625.x&partnerID=40&md5=24a379137d4e083245a3d1899d140fed","Information security technology encompasses all measures used to protect information from unauthorized disclosure, modification, or destruction. In an age when information is widely recognized as a valuable commodity, information security has become particularly vital. This issue of the AT&T Technical Journal brings together papers on various aspects of digital electronic information security, representing work in many areas of the company. This paper presents a brief overview of the problems addressed by information security technology and how its focus has changed with the advance of computing science. © 1988 AT&T Technical Journal","","CRYPTOGRAPHY; ACCESS PROTECTION; INFORMATION SECURITY; SECURE SYSTEMS; SECURITY TECHNOLOGY; SYSTEM V/MLS; DATA PROCESSING"
"Kaiser F.M.","Kaiser, Frederick M. (7102610758)","7102610758","The impact of overclassification on personnel and information security","1986","4","10.1016/0740-624X(86)90077-8","https://www.scopus.com/inward/record.uri?eid=2-s2.0-46149138711&doi=10.1016%2f0740-624X%2886%2990077-8&partnerID=40&md5=fec3f4b7ab2169f6e75e2b22aaaf021e","Unnecessary and unwarranted classification adversely affects both information and personnel security systems in a variety of ways. This study explores the range of possible repercussions and identifies the findings and recommendations of major examinations of these systems over the past thirty years. Although consensus exists that Overclassification poses problems for information and personnel security, wide disagreement is evident over the perceived centrality and seriousness of Overclassification, its principal causes, and its remedies. Nowhere are these differences more manifest than in the assumptions, conclusions, and recommendations emerging from the Reagan Administration and Congress in 1985. © 1986.","",""
"Walker Douglas D.","Walker, Douglas D. (55468104800)","55468104800","GENERAL ELECTRIC: AN APPROACH TO DISASTER RECOVERY.","1984","0","","https://www.scopus.com/inward/record.uri?eid=2-s2.0-0021567963&partnerID=40&md5=18d472c3d887ce44b6657f20f84ae7bf","Business dependency on information systems deepens many executives' concerns about protecting their information resources against intrusion and disaster. In diversified companies, it is easy to cite differences in products and information processing systems as justification for making each profit center carry full operational and investment responsibility for its own disaster recovery. At General Electric, commonalities in both facilities and equipment lead to an approach which conserved investments and vitalized each profit-center's recovery plan. A company-wide 'disaster prevention service' has emerged, and it includes a 'disaster recovery facility'. It does not prevent nature's disasters; it does keep them from becoming disasters to profit-center performance. Disaster prevention is one part of the company-wide Information Security and Control Program.","","DATA PROCESSING, BUSINESS - Fire Protection; COMPUTER SECURITY; DISASTER RECOVERY; GENERAL ELECTRIC COMPANY; INFORMATION SECURITY; COMPUTER SYSTEMS, DIGITAL"
"Paans R.","Paans, Ronald (6603341035)","6603341035","IFIP/Sec'86: Information security: The challenge","1987","0","10.1016/0167-4048(87)90088-5","https://www.scopus.com/inward/record.uri?eid=2-s2.0-50849149478&doi=10.1016%2f0167-4048%2887%2990088-5&partnerID=40&md5=56db9ddf07fb0a906d60f357eb13fa99","[No abstract available]","",""
"Wood C.C.","Wood, Charles Cresson (57210508279)","57210508279","A context for information systems security planning","1988","6","10.1016/0167-4048(88)90196-4","https://www.scopus.com/inward/record.uri?eid=2-s2.0-9744223181&doi=10.1016%2f0167-4048%2888%2990196-4&partnerID=40&md5=ae375160fb329925db7e2730cd19a545","Management is often rightfully dissatisfied with the performance of many information security efforts. After investment of considerable resources, and prolonged waiting for results, many efforts can demonstrate little if any significant improvement. This is largely due to a lack of planning. Many efforta lack explicitly articulated plans as well as specific performance milestones. Although many are loathe to admit it, information security efforts at many organizations lack formal planning and performance monitoring. Management's dissatisfaction with information security is exemplified by the seriously inadequate staffing levels found at a large number of organizations. When management is convinced that information security is a prudent investment, they will respond with additional resources. This article examines why information security efforts are often ineffective and why more formal planning efforts can alleviate this condition. It discusses tools best used to prepare an action plan for information security and gives some tips on how to sell such a plan to management. Also discussed are organizational design, policies, standards, and guidelines and other elements of a foundation that is required if an effective information security planning process is to be sustained. The article dwells on the establishment of a context for effective information security planning. © 1988.","Cost effectiveness; Goal setting; Information security; Performance monitoring; Project planning; Risk analysis; Systems security",""
"Murayama Kazuo; Aono Tetsuaki; Okano Tetsuya; Baba Hiroshi; Sakanushi Yoshiaki; Nakatsubo Takashi","Murayama, Kazuo (7201902302); Aono, Tetsuaki (7102468929); Okano, Tetsuya (7402598904); Baba, Hiroshi (7201934044); Sakanushi, Yoshiaki (6504783903); Nakatsubo, Takashi (7003568877)","7201902302; 7102468929; 7402598904; 7201934044; 6504783903; 7003568877","DEVELOPMENT OF AN URBAN CATV AMPLIFIER.","1988","0","","https://www.scopus.com/inward/record.uri?eid=2-s2.0-0023868199&partnerID=40&md5=aba3efea125a6532a53469dd1f47645c","Due to the large transmission capacity of CATV which gives it a wide range of potential uses, a number of facilities other than those for only simultaneous retransmission of television broadcasts are coming into existence. These facilities are used for independent broadcasting of local information, security, and automatic meter reading. In addition, a number of plans to build two-way urban CATV systems in Japan's major cities have been proposed and are attracting much interest as a significant development in today's media devices. Designed for use in urban CATV, a highly functional, compact, lightweight 350/450 MHz amplifier has been developed. The system and its reliability have been evaluated and it has been determined that it has sufficient practical applicability. The results are reported.","","AMPLIFIERS, VIDEO; URBAN PLANNING - Japan; CATV AMPLIFIER; HIGH-RISE BUILDINGS; TRUNK AND BRIDGING AMPLIFIER; URBAN CENTERS; TELEVISION SYSTEMS, CABLE"
"Clark David D.; Wilson David R.","Clark, David D. (55613235535); Wilson, David R. (57198541648)","55613235535; 57198541648","COMPARISON OF COMMERCIAL AND MILITARY COMPUTER SECURITY POLICIES.","1987","674","","https://www.scopus.com/inward/record.uri?eid=2-s2.0-0023266943&partnerID=40&md5=2b3c7a3cfec673cfd8f118203e78ef2d","The authors present a policy for data integrity based on commercial data processing practices, and compare the mechanisms needed for this policy with the mechanisms needed to enforce the lattice model for information security. It is argued that a lattice model is not sufficient to characterize integrity policies, and that distinct mechanisms are needed to control disclosure and to provide integrity.","","COMPUTERS - Applications; COMMERCIAL COMPUTER SECURITY; COMPUTER SECURITY; MILITARY COMPUTER SECURITY; DATA PROCESSING"
"Kirkwood Timothy J.","Kirkwood, Timothy J. (7005054645)","7005054645","Security issues in the telecommunications industry","1989","0","","https://www.scopus.com/inward/record.uri?eid=2-s2.0-0024777328&partnerID=40&md5=306d77095feddd6b01d6a9372159478d","Information security is a growing concern for both industry and Government. Until a few years ago, security-related losses in industry were primarily due to disgruntled or misled employees. More recently, hackers from the outside without special access authorizations have gained the spotlight as they use various public and private networks to gain corporate intelligence, transfer free services to friends, or disrupt data processing activities. The weaknesses exploited in many of the more recent hacker cases represent a combination of naive system design and lax administration. Security measures must address both information system design and information policy administration.","","Computer Crime; Industrial Management; Telecommunication"
"Paans R.; Herschberg I.S.","Paans, R. (6603341035); Herschberg, I.S. (6603071752)","6603341035; 6603071752","HOW TO CONTROL MVS USER SUPERVISOR CALLS.","1985","0","","https://www.scopus.com/inward/record.uri?eid=2-s2.0-0022300296&partnerID=40&md5=0b045ae0b5a0a537a9f7085318d06a84","Many computing centres install their own extensions to standard operating systems. These extensions, when processed in an authorized status, may seriously endanger system integrity. This paper, based on case studies over the past five years, spells out the risks run by computing centres under multiple virtual storage (MVS) installing home-grown user SuperVisor Calls. A set of design requirements is formulated with which these user SVCs must comply if they are to be considered secure. The latest developments in improving the security of some risky operations also are outlined.","","SECURITY SYSTEMS - Computer Applications; DESIGN REQUIREMENTS; INFORMATION SECURITY; MVS USER SUPERVISOR CALLS; SYSTEM CONTROLLABILITY; DATA PROCESSING"
