"Authors","Author full names","Author(s) ID","Title","Year","Cited by","DOI","Link","Abstract","Author Keywords","Index Keywords"
"Iversen K.R.","Iversen, K.R. (7005848488)","7005848488","Security requirements for electronic patients records: The Norwegian view","1994","1","","https://www.scopus.com/inward/record.uri?eid=2-s2.0-0028371069&partnerID=40&md5=f8e923f5315a36effdaff9334b565cfa","Information security, including secrecy, privacy and data integrity, quality and availability, are fundamental issues when electronic patient records are introduced and used. In this paper we outline the results of a project that KITH carried out on an assignment from the Norwegian Ministry of Health. We describe the general and detailed requirements set up in the project for electronic patient records, and to the hospitals that take such into use. We believe that these requirements are the minimum necessary to give a positive answer to the question of whether electronic patient records can meet all the security-related requirements and intentions given by current regulations. In our work we have focused on secrecy, privacy and data integrity, but also on elaborating requirements that allow a user friendly and suitable implementation of electronic patient record systems.; Information security, including secrecy, privacy and data integrity, quality and availability, are fundamental issues when electronic patient records are introduced and used. In this paper we outline the results of a project that KITH carried out on an assignment from the Norwegian Ministry of Health. We describe the general and detailed requirements set up in the project for electronic patient records, and to the hospitals that take such into use. We believe that these requirements are the minimum necessary to give a positive answer to the question of whether electronic patient records can meet all the security-related requirements and intentions given by current regulations. In our work we have focused on secrecy, privacy and data integrity, but also on elaborating requirements that allow a user friendly and suitable implementation of electronic patient record systems.","Accountability; Authorisation; Availability; Electronic patient record; Patients rights; Security requirements","Computer Communication Networks; Computer Security; Confidentiality; Forms and Records Control; Management Information Systems; Medical Records; Medical Records Systems, Computerized; Norway; Organizational Policy; Policy Making; Security Measures; User-Computer Interface; File organization; Hospitals; Information retrieval systems; Laws and legislation; Medical computing; Records management; computer security; conference paper; health care; human rights; information retrieval; information system; law; medical information; medical record; norway; priority journal; privacy; quality control; regulatory mechanism; Accountability; Authorization; Availability; Electronic patient record; Patients rights; Security requirements; Security of data"
"Duncan R.J.","Duncan, Rebecca J. (7401604541)","7401604541","There are some cracks in the cornerstone of information security","1995","1","10.1016/0167-4048(96)81707-X","https://www.scopus.com/inward/record.uri?eid=2-s2.0-0029533453&doi=10.1016%2f0167-4048%2896%2981707-X&partnerID=40&md5=ae31bdc8975e8040bd36b2786deb9a23","[No abstract available]","","Computer software; Computer system recovery; Computer systems; Computer viruses; Information services; Microcomputers; Personal computers; Planning; Surveys; Disaster recovery; Mainframe computer security; Security plans; Security policy; Security risks; Security of data"
"du Toit L.M.; von Solms S.H.","du Toit, L.M. (7004301549); von Solms, S.H. (6701572289)","7004301549; 6701572289","Model for organizing information security documentation","1993","0","","https://www.scopus.com/inward/record.uri?eid=2-s2.0-0027747729&partnerID=40&md5=cf86058cb572a41f5cc22f9a2f46a4bc","The ISD Model describes a way to organize all relevant security measures, documentation and management's point of view in order to ensure a more effective implementation of information security. The model consists of three levels. Each of these levels represent a separate group of documents used in the attempt to ensure secure information. The Information Security Policy Document (ISPD) forms the top level of the model and serves as the most important factor in encouraging the involvement of top management in the implementation of information security. The second level contains the Goal Document(s) (GD). The purpose of the document or set of documents on this level is to place the ISPD into perspective. Implementation guidelines, which include the detailed procedures and standards, are placed in the Application Guideline Document(s) (AGD) on the lowest level of the ISD Model. Examples are also included.","","Computer science; Data handling; Information dissemination; Information retrieval; Management information systems; Public policy; Standards; Application guideline document (AGD); Goal document (GD); Information security documentation (ISD); Information security policy document (ISPD); Security of data"
"Hardjono T.; Ohta T.","Hardjono, Thomas (6701612512); Ohta, Tadashi (35557271100)","6701612512; 35557271100","Secure end-to-end delegations in distributed systems","1994","2","10.1016/0140-3664(94)90008-6","https://www.scopus.com/inward/record.uri?eid=2-s2.0-43949151117&doi=10.1016%2f0140-3664%2894%2990008-6&partnerID=40&md5=712c65805b6f5805e088e61d860962fc","Delegation of tasks represents an important aspect of a distributed system, which sustains the availability of services offered by such a system. A necessary requirement of delegations is that they be performed in a secure and manner. This paper presents a delegation scheme based on an adapted ZS-3 public key cryptosystem24. The scheme allows an originator of the delegation to specify the executor of the delegated task and the intermediaries that participate in the event. It also features the ability of the executor to verify that all participating intermediaries remain uncompromised. The scheme attains a level of security against internal and external attacks, which is equivalent to the solving of instances of the discrete logarithm problem, thus making it an attractive candidate for delegations in distributed systems from the point of view of security. © 1994.","authentication; delegation; distributed systems; information security; secure communications",""
"Mizutani Ryo; Matsumoto Tsutomu","Mizutani, Ryo (7003422860); Matsumoto, Tsutomu (7407963117)","7003422860; 7407963117","Evaluating security of a simple interactive human identification scheme","1995","3","","https://www.scopus.com/inward/record.uri?eid=2-s2.0-0029308236&partnerID=40&md5=1d718516cc2b7a4b3bb5fc26aa5c7706","Password checking schemes are human identification methods commonly adopted in many information systems. One of their disadvantages is that an attacker who correctly observed an input password can impersonate the corresponding user freely. To overcome it there have been proposed interactive human identification schemes. Namely, a human prover who has a secret key is asked a question by a machine verifier, who then checks if an answer from the prover matches the question with respect to the key. This letter examines such a scheme that requires relatively less efforts to human provers. By computer experiments this letter evaluates its resistance against a type of attack; after observing several pairs of questions and correct answers how successfully can an attacker answer the next question?","","Data reduction; Database systems; Network protocols; Security of data; User interfaces; Human cryptography; Human interface; Information security; Passwords; Prover; Verifier; Cryptography"
"Lesser Roger","Lesser, Roger (7102209923)","7102209923","So you think your information is secure - is it?","1995","0","","https://www.scopus.com/inward/record.uri?eid=2-s2.0-0029309567&partnerID=40&md5=308804a389626c495ddcddccbb7518d1","Because computers and networks are today's common access through which confidential information is pilfered by adversaries, organizations are seeking the best way to protect sensitive information. To circumvent the possibility of getting information from floppy disks which are often left inadvertently, it is suggested to use the TAG labels from Avanti Associates Inc. The use of TAG labels can preclude an individual leaving a disk in a disk drive because TAG labels have portion of the labels hanging out of the disk drives. To protect computer system from illegal access, firewalls which provide a barrier between computer system and unauthorized access can be used. In addition to firewall, Kerberos can be employed to secure information through its authentication server and a 'ticket-granting' server. Protection via encryption also proves to be an efficient way of securing information.","","Computer networks; Computer systems; Computers; Cryptography; Data communication equipment; Database systems; Floppy disk storage; Graphical user interfaces; Object oriented programming; UNIX; Fileserver; Information security; Security of data"
"Furnell S.M.; Sanders P.W.; Warren M.J.","Furnell, S.M. (7003551084); Sanders, P.W. (57217416758); Warren, M.J. (7202137569)","7003551084; 57217416758; 7202137569","Development of security guidelines for existing healthcare systems","1995","0","10.3109/14639239509025352","https://www.scopus.com/inward/record.uri?eid=2-s2.0-84907111253&doi=10.3109%2f14639239509025352&partnerID=40&md5=0e07da8799a91a9c633f4e2ba51887eb","As modern healthcare establishments become increasingly dependent upon information systems it is vital to ensure that adequate security is present to safeguard the confidentiality and integrity of data and the availability of systems. Whilst this is now generally recognized in the design of new systems, many existing operational systems have been implemented without security in mind. This paper describes the need for a standardized approach in the protection of existing healthcare systems within Europe and presents an overview of a new set of information security guidelines that have been developed specifically for the medical community. The guidelines discussed have been produced as a deliverable of the Commission of European Communities (CEC) SEISMED (Secure Environment for Information Systems in Medicine) project, under the Advanced Informatics in Medicine (AIM) programme. © 1995 Informa UK Ltd All rights reserved: reproduction in whole or part not permitted.","Baseline protection; Existing systems; Guidelines; Security","article; confidentiality; Europe; health care organization; information system; medical information; practice guideline"
"Götherström C.; Hamrin E.; Gullberg M.","Götherström, Christine (6603082243); Hamrin, Elisabeth (7006324735); Gullberg, Mats (18934839700)","6603082243; 7006324735; 18934839700","Development of a tool for measuring the concept of good care among patients and staff in relation to Swedish legislation","1995","6","10.1016/0020-7489(94)00046-M","https://www.scopus.com/inward/record.uri?eid=2-s2.0-0029314925&doi=10.1016%2f0020-7489%2894%2900046-M&partnerID=40&md5=f8bf45f9a50d23b25ac4ab6ba3e63790","An instrument for measuring the concept of good care, in relation to the Swedish Health and Medical Services Act, has been developed and tested in short-term care. The instrument comprises 14 statements on good care. The construct validity was estimated by factor analysis based on the results from 240 patients. Five factors explained 62% of the variance of the 14 variables and covered the following areas: information, security, accessibility, continuity, and influence and respect. Patients (n = 240) and registered nurses (n = 57) showed differences in estimations of the concept of good care on all factors. There were only minor differences, however, within the patient group and the nursing group, respectively, on comparing the two samples. The instrument needs further testing in different care conditions. © 1995.","","Adult; Aged; Attitude of Health Personnel; Attitude to Health; Factor Analysis, Statistical; Female; Human; Male; Nursing Audit; Nursing Care; Nursing Evaluation Research; Quality of Health Care; Questionnaires; Reproducibility of Results; Support, Non-U.S. Gov't; Sweden; adult; aged; article; attitude; factorial analysis; female; health care quality; human; legal aspect; male; methodology; nursing; psychological aspect; questionnaire; reproducibility; standard; Sweden"
"Blaze M.","Blaze, Matt (7003490794)","7003490794","Key management in an encrypting file system","1994","32","","https://www.scopus.com/inward/record.uri?eid=2-s2.0-85084163095&partnerID=40&md5=b1ea65bcddbe40dd4e7d5c83991b1545","As distributed computing systems grow in size, complexity and variety of application, the problem of protecting sensitive data from unauthorized disclosure and tampering becomes increasingly important. Cryptographic techniques can play an important role in protecting communication links and file data, since access to data can be limited to those who hold the proper key. In the case of file data, however, the routine use of encryption facilities often places the organizational requirements of information security in opposition to those of information management. Since strong encryption implies that only the holders of the cryptographic key have access to the cleartext data, an organization may be denied the use of its own critical business records if the key used to encrypt these records becomes unavailable (e.g., through the accidental death of the key holder). This paper describes a system, based on cryptographic ""smartcards,"" for the temporary ""escrow"" of file encryption keys for critical files in a cryptographic file system. Unlike conventional escrow schemes, this system is bilaterally auditable, in that the holder of an escrowed key can verify that, in fact, he or she holds the key to a particular directory and the owner of the key can verify, when the escrow period is ended, that the escrow agent has neither used the key nor can use it in the future. We describe a new algorithm, based on the DES cipher, for the online encryption of file data in a secure and efficient manner that is suitable for use in a smartcard. © 1994 USENIX Association. All rights reserved.","","File organization; Information management; Security of data; Smart cards; Critical business; Cryptographic file systems; Cryptographic key; Cryptographic techniques; Distributed computing systems; Encrypting file systems; Sensitive datas; Unauthorized disclosures; Public key cryptography"
"Imai H.","Imai, Hideki (56894680100)","56894680100","Information security aspects of spread spectrum systems","1995","0","","https://www.scopus.com/inward/record.uri?eid=2-s2.0-84955582572&partnerID=40&md5=88d3831473d8392e5a62e9fe2e7c9e93","Recently spread spectrum systems have been intensively studied and developed for new commercial applications in cellular mobile communication networks and wireless personal communication networks. This is because they have some advantages such as robustness against interference and noise, low probability of intercept, anti-jamming property, high communication capacity per frequency and so on. Some of these features have given spread spectrum systems reputation that they have high information security. A purpose of this paper is to examine this reputation. It is often claimed that in some spread spectrum communication systems, noise and interference have much higher power than the desired signal so that any opponent who does not know the spreading mechanism cannot detect the signal. It is shown, however, that the knowledge of the spreading mechanism gives legitimate users at most about 5 dB advantage of signal to noise ratio over opponents. Therefore, in order to protect privacy, it is recommended to encrypt transmitting data. From the viewpoint of privacy, untraceablity is also important. We propose a registration protocol for cellular systems to keep users unidentified by opponents. From the aspects of information security, the most significant feature peculiar to spread spectrum systems is anti-jamming property. We discuss some designing methodology for spreading mechanisms to strengthen this property. © 1995, Springer-Verlag Berlin Heidelberg.","CDMA; Cellular system; Information security; Jamming; Spread spectrum system; Untraceabitity","Code division multiple access; Cryptography; Jamming; Mobile telecommunication systems; Personal communication systems; Security of data; Security systems; Signal to noise ratio; Spectroscopy; Cellular mobile communications; Cellular system; Commercial applications; Communication capacity; Low probability of intercept; Spread spectrum systems; Untraceabitity; Wireless personal communications; Spread spectrum communication"
"","","","4th International Conference on the Theory and Applications of Cryptology, ASIACRYPT 1994","1995","0","","https://www.scopus.com/inward/record.uri?eid=2-s2.0-84955603993&partnerID=40&md5=a4fa4a1b12594d88f1c9d6bb56631845","The proceedings contain 36 papers. The special focus in this conference is on Secret Sharing and Stream Ciphers. The topics include: Multifeature security through homomorphic encryption; multiplicative non-abelian sharing schemes and their application to threshold cryptography; lower bound on the size of shares of nonperfect secret sharing schemes; on sharing many secrets; combinatorial interpretation of secret sharing schemes; a correlation attack on the binary sequence generators with time-varying output function; intrinsic statistical weakness of keystream generators; semi-bent functions; structures of cryptographic functions with strong avalanche characteristics; formal verification of eryptographie protocols; efficient electronic money; how to prevent buying of votes in computer elections; design and analysis of key exchange protocols via secure channel identification; zero-knowledge proofs of computational power in the shared string model; information security aspects of spread spectrum systems; combinatorial structure of a-codes with r-fold security; meta-message recovery and meta-blind signature schemes based on the discrete logarithm problem and their applications; a digital signature scheme based on linear error-correcting block codes; secure acceleration of DSS signatures using insecure server; the magic words are squeamish ossifrage; security of the center in key distribution schemes; incidence structures for key sharing; a public-key cryptosystem and a digital signature system based on the lucas function analogue to discrete logarithms; a unified Markov approach to differential and linear cryptanalysis; how to strengthen des using existing hardware and some cryptographic properties of exponential functions.","",""
"Coyne J.W.; Kluksdahl N.C.","Coyne, James W. (57200120699); Kluksdahl, Norman C. (6602473911)","57200120699; 6602473911","""Mainstreaming"" automated information systems security engineering (a case study in security run amok)","1994","3","10.1145/191177.191241","https://www.scopus.com/inward/record.uri?eid=2-s2.0-84968436941&doi=10.1145%2f191177.191241&partnerID=40&md5=d56ecbf60a8a59fc926ef115c2d7c809","Since mid-1992, the National Aeronautics and Space Administration (NASA) Mission Control Center (MCC) in Houston has pursued commonality and consolidation of facilities and equipment to reduce the implementation costs associated with the modernization of the control center, as well as the on-going operations and sustaining costs. In December of 1993, a management team, comprised almost entirely of individuals with manned spaceflight operations experience, was given the charter of completing the development. Past practices and conventional thinking have been set aside in an effort to deliver the new control center ""better, faster, and cheaper"". This new paradigm has carried-over to the engineering associated with securing the control center's information resources. The group originally tasked with ensuring the security of the MCC's information resources was not directly associated with development or operations of the MCC, and thus had lost sight of the fact that the MCC's mission is the command and control of space vehicles, not the pursuit of information security. Under the new paradigm for control center development, responsibility for ensuring system security and integrity has been brought into the development organization. Old methods and approaches to security have been replaced by a new approach which emphasizes the implementation of an automated information systems security architecture that is both logical and cost effective. In both Government, and industry, it is common for those tasked with information security responsibilities to be separated from the mainstream of engineering. This separation often results in conflict during requirements definition, design, implementation and testing. The following is a case study of such an information security organization, and process, run amok. It also discusses the steps required to bring the process back into line with the goals of cost-effective development and operation. © 1994 ACM.","","Cost effectiveness; Human resource management; Information systems; Manned space flight; NASA; Security of data; Security systems; Space flight; Automated information; Command and control; Development and operations; Implementation cost; Information resource; Information security organizations; Mission control centers; Requirements definition; Costs"
"Kailay M.P.; Jarratt P.","Kailay, Muninder P. (6508357854); Jarratt, Peter (24760586900)","6508357854; 24760586900","RAMeX: a prototype expert system for computer security risk analysis and management","1995","21","10.1016/0167-4048(95)00013-X","https://www.scopus.com/inward/record.uri?eid=2-s2.0-0029508261&doi=10.1016%2f0167-4048%2895%2900013-X&partnerID=40&md5=bbd91db9ce18e2dee8aec61e3fb2dbfc","Information security is emerging as the business risk of the 90s for many commercial organizations. The commercial sector should recognise the need for a structured approach to security assessment in the form of risk analysis. This paper describes the development of RAMeX, a qualitative based prototype expert system designed for small to medium-sized commercial organizations. © 1995.","Business impact assessment; Countermeasures; Expert system; Information classification; Intentional threats; Risk analysis; Risk management; Vulnerabilities","Classification (of information); Computer crime; Computer systems; Information management; Information technology; Risk assessment; Security of data; Business impact assessment; Countermeasures; Intentional threats; Risk analysis; Risk management; Expert systems"
"Parker D.B.","Parker, Donn B. (7403381465)","7403381465","Possession as an element of information security","1995","1","10.1080/10658989509342496","https://www.scopus.com/inward/record.uri?eid=2-s2.0-84872328359&doi=10.1080%2f10658989509342496&partnerID=40&md5=b3e651d258fb978f375c96bd747c27cc","[No abstract available]","",""
"Wood C.","Wood, CharlesCresson (57210508279)","57210508279","Information security problems as evidence of management failures","1995","1","10.1016/0142-0496(95)80076-X","https://www.scopus.com/inward/record.uri?eid=2-s2.0-58149326445&doi=10.1016%2f0142-0496%2895%2980076-X&partnerID=40&md5=7a09ea24262adb78fc3657f5787ef914","What's the traditional response to the bringer of bad news? Shoot the messenger. With information security problems cropping up left and right like mushrooms on the forest floor, it's no wonder that a number of information security managers have recently been asked to find employment elsewhere. These firings are often window-dressing, not a serious attempt to solve the problem. © 1995.","",""
"Byrd C.M.; Baulch M.N.","Byrd, C.M. (7005203726); Baulch, M.N. (6506520702)","7005203726; 6506520702","Crossing the Rubicon on HIV confidentiality: medical information security in the 90's and beyond.","1995","0","","https://www.scopus.com/inward/record.uri?eid=2-s2.0-0029262026&partnerID=40&md5=58f38f89388a9898a724d59b566963b3","[No abstract available]","","Confidentiality; HIV Infections; Human; United States; article; confidentiality; human; Human immunodeficiency virus infection; legal aspect; United States"
"Madsen W.","Madsen, Wayne (57213285548)","57213285548","Information warfare: A new threat to information security and integrity","1995","0","10.1080/10658989509342503","https://www.scopus.com/inward/record.uri?eid=2-s2.0-84960630218&doi=10.1080%2f10658989509342503&partnerID=40&md5=4411dfcd3efaeb978c61bff27c1eb6a7","[No abstract available]","",""
