"Authors","Author full names","Author(s) ID","Title","Year","Cited by","DOI","Link","Abstract","Author Keywords","Index Keywords"
"","","","4th Australasian Conference on Information Security and Privacy, ACISP 1999","1999","0","","https://www.scopus.com/inward/record.uri?eid=2-s2.0-84956477360&partnerID=40&md5=9a41fbf44b904d81439ddac303ccc2aa","The proceedings contain 26 papers. The special focus in this conference is on Boolean Functions and Key Management. The topics include: Boolean function design using hill climbing methods; enumeration of correlation immune boolean functions; on the symmetric property of homogeneous boolean functions; publicly verifiable key escrow with limited time span; accelerating key establishment protocols for mobile communication; conference key agreement from secret sharing; on m-permutation protection scheme against modification attack; inversion attack and branching; fail-stop threshold signature schemes based on elliptic curves; divertible zero-knowledge proof of polynomial relations and blind group signature; repudiation of cheating and non-repudiation of zhang’s proxy signature schemes; on the security of an RSA based encryption scheme; generalised cycling attacks on RSA and strong RSA primes; RSA acceleration with field programmable gate arrays; changing thresholds in the absence of secure channels; a self-certified group-oriented cryptosystem without a combiner; companion viruses and the macintosh; an implementation of a secure version of NFS including RBAC; group signatures and their relevance to privacy-protecting off-line electronic cash systems; efficient electronic cash using batch signatures; evolution of fair non-repudiation with TTP; authorization in object oriented databases and an analysis of access control models.","",""
"Chou D.C.; Yen D.C.; Lin B.; Cheng P.H.-L.","Chou, David C. (7101791573); Yen, David C. (7102471530); Lin, Binshan (7403508463); Cheng, Philip Hong-Lam (55434348600)","7101791573; 7102471530; 7403508463; 55434348600","Cyberspace security management","1999","24","10.1108/02635579910301793","https://www.scopus.com/inward/record.uri?eid=2-s2.0-0032620196&doi=10.1108%2f02635579910301793&partnerID=40&md5=0bd3bbb471f98331e6dcf53695b24100","Through the tremendous growth of Internet users during the last few years, organizations now realize the potential market of the information highway. However, these organizations now face the problem of internet security. The open environment of the Internet contributes greatly to its success, but also plants inherent security problems. Discusses the security framework implemented in the cyberspace environment and the current developments and future trends involving this issue.","","Computer crime; Cryptography; Data privacy; Information technology; Internet; Network protocols; Standards; Cybersecurity; Cyberspace; Security of data"
"Power Richard","Power, Richard (56229595800)","56229595800","1999 CSI/FBI computer crime and security survey","1999","4","","https://www.scopus.com/inward/record.uri?eid=2-s2.0-0032650707&partnerID=40&md5=1ab1cd13208afb7c307e22ee1c7e6fc2","The annual Computer Security Institute/Federal Bureau of Investigation (CSI/FBI) Computer Crime and Security Survey is conducted as a public service by the CSI, with the participation of the San Francisco FBI computer intrusion squad. The aim of this effort is to help raise the level of security awareness as well as to assist in determining the scope of computer crime in the U.S. The findings of the 1999 survey confirm trends established over the last three annual surveys. It is clear that computer crime and other information security breaches pose a growing threat to U.S. economic competitiveness and the rule of law in cyberspace. It is also clear that the financial cost is tangible and alarming.","","Computer crime; Computer operating systems; Electronic commerce; Laws and legislation; Public policy; Technical presentations; World Wide Web; Information protection (IP); Security of data"
"Shevchenko A.I.; Ishutin A.Yu.; Beryozko A.Yu.","Shevchenko, A.I. (58357641500); Ishutin, A.Yu. (14067495200); Beryozko, A.Yu. (14067031100)","58357641500; 14067495200; 14067031100","Methods of detection of program bugs in computer systems","1999","0","10.1007/BF02835864","https://www.scopus.com/inward/record.uri?eid=2-s2.0-33747294603&doi=10.1007%2fBF02835864&partnerID=40&md5=e0d440fef3421936e07b91bf662da2be","A problem of information protection in computer systems, namely, protection from program bugs, is considered. The existing methods of detection of viruses, program bugs, and other destructive program means are considered. The stages of bug life cycle are shown. A safety filter is proposed, i.e., a protection system based on an on-line multiparameter check of program execution. ©2000 Kluwer Academic/Plenum Publishers.","Check of program execution; Information protection; Information security; Life cycle of bugs; Methods of detection of viruses and bugs; Program viruses and bugs; Safety filter",""
"Mitchell R.C.; Marcella R.; Baxter G.","Mitchell, Ruth C. (57191048029); Marcella, Rita (6701595445); Baxter, Graeme (7202105785)","57191048029; 6701595445; 7202105785","Corporate information security management","1999","28","10.1108/03074809910285888","https://www.scopus.com/inward/record.uri?eid=2-s2.0-84986133689&doi=10.1108%2f03074809910285888&partnerID=40&md5=c4442fe78e328b4e03ea867e8af1d3b2","To ensure business continuity the security of corporate information is extremely important. Previous studies have shown that corporate information is vulnerable to security attacks. Companies are losing money through security breaches. This paper describes an MSc project that aimed to investigate the issues surrounding corporate information security management. Postal questionnaires and telephone interviews were used. Findings indicate that companies are not proactively tackling information security management and thus are not prepared for security incidents when they occur. Reasons for this lack of action include: awareness of information security threats is restricted; management and awareness of information security is concentrated around the IT department; electronic information is viewed as an intangible business asset; potential security risks of Internet access have not been fully assessed; and surveyed companies have not yet encountered security problems, and therefore are unprepared to invest in security measures. The recommendations include that companies: carry out a formal risk analysis; move information security management from being an IT-centric function; and alter perceptions towards electronic information so that information is viewed as a valuable corporate asset. © 1999, MCB UP Limited","Companies; Electronic information resources; Information security",""
"Hosmer Chet","Hosmer, Chet (6603502676)","6603502676","Using SmartCards and digital signatures to preserve electronic evidence","1999","1","","https://www.scopus.com/inward/record.uri?eid=2-s2.0-0032677962&partnerID=40&md5=17b0cb76eaf4d8c56c5cb9a8446d4719","In 1993, Gene Kim and Eugene Spafford, working at the COAST Laboratory at Purdue University, developed the concept of a software `Tripwire' that would help detect changes to key system files. The process was to generate a set of one-way hash values that define the contents of key system files stored on host computers. Periodically, the hashes would be recalculated and compared to the stored original to determine if any change could be detected. Each unexpected result would be investigated to determine if the change was malicious or accidental. Today, digital signature technologies are being used in many aspects of information security, including proof of identity, authentication, authorization, integrity and non-repudiation. The combination of Kim & Spafford's early research, and the application of digital signatures and SmartCards to the preservation of computer based evidence, is the basis of this paper. We will discuss the technical and operational weaknesses of current methods employed to protect the integrity of computer evidence, and recommend solutions for simplifying and enhancing the evidence preservation and collection process.","","Computer software; Smart cards; Computer forensics; Digital signatures; Security of data"
"Kwok L.-F.; Longley D.","Kwok, Lam-For (57220912536); Longley, Dennis (7003965855)","57220912536; 7003965855","Information security management and modelling","1999","33","10.1108/09685229910255179","https://www.scopus.com/inward/record.uri?eid=2-s2.0-0011508763&doi=10.1108%2f09685229910255179&partnerID=40&md5=a5ab235cc0cb7c757136c253b21c5e6b","Information security management has been placed on a firmer footing with the publication of standards by national bodies. These standards provide an opportunity for security managers to gain senior management recognition of the importance of procedures and mechanisms to enhance information security. They may also place demands on security managers to provide convincing demonstration of conformance to the standards. The risk data repository (RDR) computer model described in this paper was developed to manage organisational information security data and facilitate risk analysis studies. The RDR provides a form of computer documentation that can assist the security officer to maintain a continuous record of the organisational information security scenario and facilitate system security development, business continuity planning and standards conformance audits.","Computer security; Data security; Information systems; Modelling; Risk management; Standards",""
"Ting T.C.","Ting, T.C. (7102687790)","7102687790","Privacy and confidentiality in healthcare delivery information system","1999","9","","https://www.scopus.com/inward/record.uri?eid=2-s2.0-0032642924&partnerID=40&md5=9bcf1db1dd440636f2b192a2565ffa15","The issue of confidentiality and invasion of privacy has become increasingly prominent as the use of computing and communication technologies becomes widespread. The importance of individual privacy has long been recognized in a democratic society. Laws and regulations, such as privacy and freedom of information acts, have been introduced to assure and safeguard individual rights. However, the meaning and actual requirements of information and data security for protecting these rights has not been clearly understood. Information security concerns in health care delivery information systems are particularly sensitive. This plenary address is intended to stimulate discussions at the conference on identifying and representing information security requirements and semantics for the development of security policies and enforcement techniques for healthcare delivery information system.","","Data privacy; Health care; Linguistics; Public policy; Security of data; Healthcare delivery information system; Medical computing"
"Asaro P.V.; Herting Jr. R.L.; Roth A.C.; Barnes M.R.","Asaro, P.V. (8262338800); Herting Jr., R.L. (57189164383); Roth, A.C. (7403051232); Barnes, M.R. (57196579790)","8262338800; 57189164383; 7403051232; 57196579790","Effective audit trails--a taxonomy for determination of information requirements.","1999","5","","https://www.scopus.com/inward/record.uri?eid=2-s2.0-0033257294&partnerID=40&md5=d79b42a279dd68c660a71b8644859e0e","Current methods of detecting confidentiality breaches in electronic medical record systems are inadequate, partially due to the lack of necessary information at the point of audit trail analysis. In order to determine the information requirements for effective audit trail analysis, we have formulated a taxonomy of confidentiality breaches. By considering scenarios in which an inappropriate access might occur, we have identified ""indicators"" of confidentiality breaches, which may be thought of as evidence suggesting the possibility that a confidentiality breach has occurred. The collection of facts needed to describe the indicators provides insight into the types of information needed to improve confidentiality breach detection. Much of the information needed is unlikely to be available in the patient record. Research is needed exploring means of collecting and utilizing information from sources other than the patient record for use in improving patient information security.","","Computer Security; Confidentiality; Humans; Medical Records Systems, Computerized; article; computer security; confidentiality; human; medical record"
"Wright M.A.","Wright, Marie A. (7401558348)","7401558348","An overview of PKI","1999","1","10.1016/S1353-4858(00)80031-8","https://www.scopus.com/inward/record.uri?eid=2-s2.0-0033194191&doi=10.1016%2fS1353-4858%2800%2980031-8&partnerID=40&md5=f7d658a2607b7d7b46869e588b102789","The explosive growth of the Internet over the past decade has been fuelled by the prospects of electronic commerce and E-business. Information security has become a critical part of the burgeoning world of electronic transactions, and the presence of a supporting public-key infrastructure (PKI) has become the most viable option for this important component.1 This article begins by identifying the elements of a PKI. Next, it describes ways in which certificates may be validated, and discusses the impact of interoperability on widespread PKI usage. The article concludes with a summary of PKI concerns.","",""
"Von Solms R.","Von Solms, Rossouw (55970955300)","55970955300","Information security management: Why standards are important","1999","91","10.1108/09685229910255223","https://www.scopus.com/inward/record.uri?eid=2-s2.0-0001897127&doi=10.1108%2f09685229910255223&partnerID=40&md5=a7a17f54613da109142b2719c7b0e3ca","Information security is no longer a domestic issue. In this age of electronic commerce, one company's information security certainly affects their business partners. For this reason it became imperative that business partners demand an acceptable level of information security from one another. Information security management standards should certainly play a major role in this regard. In this paper, some information security management standards and their applicability will be discussed and put into context.","Certification; Computer security; Data security; Evaluation; Information management; Standards",""
"Leong S.S.; Vun N.C.H.","Leong, S.S. (36792756600); Vun, Nicholas C. H. (6506443507)","36792756600; 6506443507","Design and implementation of an authentication protocol for home automation systems","1998","9","10.1109/30.713213","https://www.scopus.com/inward/record.uri?eid=2-s2.0-0032141327&doi=10.1109%2f30.713213&partnerID=40&md5=4693046d2cdc912174fb607f1c9c2973","This paper presents an authentication protocol using the SPEKE strong password method to address current information-security deficiencies found in most Smart Home Automation systems. The protocol emphasizes on analyzing operation and security performances limited by practical low-cost micro-controller implementations (e.g. 8051 or 68HC11) of consumer electronic equipment and appliances. © 1998 IEEE.","","Automation; Consumer electronics; Microcontrollers; Security of data; Authentication protocols; Home automation systems; Network protocols"
"","","","International Conference on the Theory and Application of Cryptology and Information Security, ASIACRYPT 1999","1999","0","","https://www.scopus.com/inward/record.uri?eid=2-s2.0-84956912303&partnerID=40&md5=932ecdca1e6a70edc7966c7bedddc859","The proceedings contain 32 papers. The special focus in this conference is on Asymmetric Key Cryptosystems and. The topics include: Modulus search for elliptic curve cryptosystems; on the lai-massey scheme; on cryptographically secure vectorial boolean functions; cryptanalysis of five rounds of CRYPTON using impossible differentials; cryptanalysis of two cryptosystems based on group actions; probabilistic higher order differential attack and higher order bent functions; fast algorithms for elliptic curve cryptosystems over binary finite field; optimizing the menezes-okamoto-vanstone (MOV) algorithm for non-supersingular elliptic curves; speeding up the discrete log computation on curves with automorphisms; do we need to count?; elliptic scalar multiplication using point halving; on the design of RSA with short secret exponent; efficient public-key cryptosystems provably secure against active adversaries; adaptively-secure optimal-resilience proactive RSA; how to prove that a committed number is prime; reducing logarithms in totally non-maximal imaginary quadratic orders to logarithms in finite fields; general adversaries in unconditional multi-party computation; approximation hardness and secure communication in broadcast channels; mix-networks on permutation networks; secure communication in an unknown network using certificates; linear complexity versus pseudorandomness; a class of explicit perfect multi-sequences; cryptanalysis of LFSR-encrypted codes with unknown combining function; doing more with fewer bits; an efficient hierachical identity-based key-sharing method resistant against collusion-attacks; periodical multi-secret threshold cryptosystems; a signature scheme with message recovery as secure as discrete logarithm and broadcast authentication in group communication.","",""
"Dinnie G.","Dinnie, G. (57191768791)","57191768791","The Second Annual Global Information Security Survey","1999","27","10.1108/09685229910693812","https://www.scopus.com/inward/record.uri?eid=2-s2.0-84993016651&doi=10.1108%2f09685229910693812&partnerID=40&md5=9ea368edc5a62226f7aa6e4065bc6b59","The second Ernst & Young Information Security Survey was compiled from the responses of 4,254 IT managers in 29 countries spanning North and South America, Europe, Africa and Australasia. All the main industry groups were represented. It provides many lessons as to how companies should approach the pressing issue of information security. © 1999, MCB UP Limited","Computer security; Data security; Information resources management; Surveys",""
"Kobayashi T.; Morita H.","Kobayashi, Tetsutaro (56045551300); Morita, Hikaru (7402384556)","56045551300; 7402384556","Fast modular inversion algorithm to match any operation unit","1999","19","","https://www.scopus.com/inward/record.uri?eid=2-s2.0-0032634944&partnerID=40&md5=cdcbe4142296fc18fe84ea8451cf2415","Speeding up modular inversion is one of the most important subjects in the field of information security. Over the elliptic curve -on the prime finite field in particular goals - public-key cryptosystems and digital signature schemes frequently use modular inversion if affine coordinates are selected. In the regular computer environment, most data transmission via networks and data storage on memories as well as the operation set of processors are performed in multiples of eight bits or bytes. A fast modular multiplication algorithm that matches these operation units for DSP was proposed to accelerate the Montgomery method by Dusse and Kaliski [2]. However, modular inversion algorithms were developed using bit by bit operation and so do not match the operation unit. This paper proposes two techniques for modular inversion that suits any arbitrary processing unit. The first technique proposes a new extended GCD procedure without any division. It can be constructed by the shifting, adding and multiplying operations, all of which a Montgomery modular arithmetic algorithm employs. The second technique can reduce the delay time of post processing in the modular inversion algorithm. In particular, it is of great use for the modular inversion defined in the Montgomery representation. These proposed techniques make modular inversion about 5.5 times faster.","Binary gcd; Elliptic-curve cryptosystem; Euclidean algorithm; Modular inversion; Montgomery method","Algorithms; Cryptography; Digital signal processing; Fast modular inversion algorithm; Security of data"
"Anon","Anon (1)","1","Information Security Program of the Year: Sample policies and procedures","1999","0","","https://www.scopus.com/inward/record.uri?eid=2-s2.0-0033485774&partnerID=40&md5=f43a512e4426994329e679c5344b878e","The Principal Financial Group is proud to be the recipient of CSI's 1998 Information Security Program of the Year Award. Some policies and procedures, excerpts from Principal's LAN Administrators Security Manual and Corporate Handbook on Information Protection, on `Unauthorized Use,' `Password Guidelines' and `E-mail Security' are presented.","","Client server computer systems; Computer software; Cryptography; Data communication systems; Data privacy; Electronic mail; Local area networks; Password protection; Security of data"
"Kirby J.; Archer M.; Heitmeyer C.","Kirby, James (24172574800); Archer, Myla (7102488461); Heitmeyer, Constance (7003309900)","24172574800; 7102488461; 7003309900","Applying formal methods to an information security device: An experience report","1999","10","10.1109/HASE.1999.809478","https://www.scopus.com/inward/record.uri?eid=2-s2.0-38849133917&doi=10.1109%2fHASE.1999.809478&partnerID=40&md5=931d96df54dea946a48d5300681a8d20","SCR (Software Cost Reduction) is a formal method for specifying and analyzing system requirements that has previously been applied to control systems. This paper describes a case study in which the SCR method was used to specify and analyze a different class of system, a cryptographic system called CD, which must satisfy a large set of security properties. The paper describes how a suite of tools supporting SCR-a consistency checker, simulator, model checker, invariant generator, theorem prover, and validity checker-were used to detect errors in the SCR specification of CD and to verify that the specification satisfies seven security properties. The paper also describes issues of concern to software developers about formal methods, e.g. ease of use, cost-effectiveness, scalability, how to translate a prose specification into a formal notation, and what process to follow in applying a formal method and discusses these issues based on our experience with CD. Also described are some unexpected results of our case study. © 1999 IEEE.","","Cost effectiveness; Cost reduction; Formal specification; Model checking; Security of data; Specifications; Systems engineering; Analyzing system; Cryptographic systems; Different class; Experience report; Formal notations; Security properties; Software cost reductions; Software developer; Formal methods"
"McGhie L.L.; Maier P.Q.","McGhie, Lynda L. (6507694750); Maier, Phillip Q. (57167304000)","6507694750; 57167304000","Security management for the world wide web","2000","0","10.1201/9781420031560","https://www.scopus.com/inward/record.uri?eid=2-s2.0-85055778550&doi=10.1201%2f9781420031560&partnerID=40&md5=4a207e49fa63b0f041fba5293639d412","Interfaces and teaming relationships to further this goal include computer and network security and information security professional associations (CSI, ISSA, NCSA), professional technical and engineering organizations (I/EEE, IETF), vendor and product user groups, government and standards bodies, seminars and conferences, training companies/institutes (MIS), and informal networking among practitioners. © 2001 by Taylor & Francis Group, LLC.","",""
"Buzzard K.","Buzzard, Keith (6701447323)","6701447323","Computer security - what should you spend your money on?","1999","13","10.1016/S0167-4048(99)80078-9","https://www.scopus.com/inward/record.uri?eid=2-s2.0-0032632088&doi=10.1016%2fS0167-4048%2899%2980078-9&partnerID=40&md5=a27a0b0b9dd5226870ddaf0b0c9bd282","Most organizations, whether they be government, commercial or military, are now highly dependent upon their computer systems and networks in order to function. Large amounts of digital data are stored and processed in large computer systems and transmitted between computers linked together in complex communication networks. Without appropriate safeguards this data is susceptible to interception during transmission, or may be subject to various forms of attack whilst in storage or during processing. Computer misuse is seen by many as a growth industry and a serious threat which is frequently undetected and under reported. The threat posed from malicious acts is intangible and notoriously difficult to quantify, and only those incidents which are discovered appear in official statistics. However, it is clear from events which all to frequently do get reported that there is a real danger from unwarranted computer intrusions, whether they be for fun, curiosity or something more sinister. Over the past decade or so, the information security industry has grown into a multi billion dollar business, providing solutions to the perceived threats to data confidentiality, integrity and availability. Cynics argue that the industry has hyped the hacker and information warfare threat out of all proportion in order to sell their products and services. So what then are the main risks to computer systems and from a cost/benefit perspective, what computer security consultancy services offer adequate protection and value for money?","","Computer crime; Data communication systems; Laws and legislation; Risk management; Intrusion detection; Security of data"
