"Authors","Author full names","Author(s) ID","Title","Year","Cited by","DOI","Link","Abstract","Author Keywords","Index Keywords"
"Ryan S.D.; Bordoloi B.","Ryan, Sherry D. (7202072972); Bordoloi, Bijoy (6601999193)","7202072972; 6601999193","Evaluating security threats in mainframe and client/server environments","1997","23","10.1016/S0378-7206(97)00013-X","https://www.scopus.com/inward/record.uri?eid=2-s2.0-0031095932&doi=10.1016%2fS0378-7206%2897%2900013-X&partnerID=40&md5=4466b55c29e5da1adbff9e363054ba83","Recently, client/server computing has become a serious alternative to mainframe computing in industry. It offers some benefits, but it also exposes the computing environment to additional risks: the flexibility that makes it attractive can also make it more vulnerable to security breaches. This paper reports the results of a study that explored how companies that were moving from a mainframe environment to one that included client/server technology, evaluated and took measures to protect against potential information security threats. Apparently, although security measures in the mainframe environment have been well implemented relative to their perceived threat, the same cannot be said about the client/server environment. Certain critical areas in the client/server environment in which security exposure is likely are discussed. Organizations must become aware of these critical areas and ensure that appropriate security measures are implemented to reduce the possibility of loss. © 1997 Elsevier Science B.V.","Client/server systems; Computer security; Information security; Management of security; Security concern","Computer networks; Information management; Information technology; Societies and institutions; Centralized mainframe system; Client server systems; Security of data"
"Krull Alan R.","Krull, Alan R. (7003527119)","7003527119","GSSP (generally-accepted system security principles): a trip to abilene?","1996","2","10.1016/S0167-4048(97)88112-6","https://www.scopus.com/inward/record.uri?eid=2-s2.0-0030416807&doi=10.1016%2fS0167-4048%2897%2988112-6&partnerID=40&md5=0d62ac500d3325a50d301e1617251aa0","The latest GSSP draft deals primarily with Pervasive Principles. The draft is now longer than the Magna carta and the US Constitution combined. This article gives observations on, and asks questions about, some major exercises in information security standardization.","","Control; Management; Personnel; Professional aspects; Standardization; Standards; Control standards; Generally accepted system security principles; Management standards; Security standards; Vendors; Security of data"
"Jøsang A.","Jøsang, Audun (6602387184)","6602387184","The right type of trust for distributed systems","1996","215","10.1145/304851.304877","https://www.scopus.com/inward/record.uri?eid=2-s2.0-84949942881&doi=10.1145%2f304851.304877&partnerID=40&md5=30043e85ca29eb38c260fcc4a486097e","Research in information security has traditionally focused on where to place or how to propagate trust. In that sense, a cryptographic algorithm or protocol is simply a mechanism to transfer trust from where it exists to where it is needed. This paper puts the focus on trust itself and shows that it is a very complex concept with many interesting and important implications. We do not attempt to define a formal trust model, but rather examine the types of trust and trust relationships which are relevant for information security. It is shown that the existence of trust as a phenomenon depends on the existence of malicious behaviour. This observation leads to the distinction between passionate entities with human-like capabilities, and rational entities which basically are systems. Trust can then be defined as the belief that a rational entity will resist malicious manipulation or that a passionate entity will behave without malicious intent. It is also shown that trust relationships exhibit a great diversity, that they are based on knowledge and that they contain aspects in common with strategy games.","","Security of data; Cryptographic algorithms; Distributed systems; Human like; Strategy games; Trust modeling; Trust relationship; Network security"
"Kanto J.","Kanto, Jussi (7102245885)","7102245885","Preoperative anxiety. Assessment and treatment","1996","5","10.2165/00023210-199606040-00003","https://www.scopus.com/inward/record.uri?eid=2-s2.0-0029826193&doi=10.2165%2f00023210-199606040-00003&partnerID=40&md5=fc82a158a449d4f453adc969fcc65290","The nature of preoperative anxiety appears to vary from patient to patient, and the natural course of the condition has not been well evaluated. In clinical studies, the incidence of preoperative anxiety has varied widely, from 11 to 80%, depending on the methods used to assess it. Because there appears to be a relationship between high preoperative level of anxiety and greater surgical risk, attempts to measure and relieve presurgical anxiety seem to be of clinical significance. There are several problems with the designs and methods used in past and more recent studies of premedication. Many of the recent results were produced from studies that used a variety of more or less validated assessments, yielding variable results in different centres which can seldom be compared with each other. More accurate and generally accepted but simple assessments are needed to study the anxiolytic effect of different premedicants. Benzodiazepines are the most popular preoperative agents because their anxiolytic effect is associated with high patient acceptance and they are devoid of significant adverse effects. However, great interindividual variation in response does occur. It is likely that new methods of administering benzodiazepines (such as by intranasal, transmucosal and rectal routes) could increase the utility of these agents. The preoperative anxiolytic effect of antipsychotics, antihistamines and barbiturates is questionable, but some opioids and especially α2 receptor agonists appear to have this property. However, clinically significant unwanted effects may prevent the routine use of the latter 2 drug groups. It should be noted that all patients do not automatically require pharmacological premedication. Good preoperative information, assurance and a positive attitude of hospital personnel may be the best treatment for preoperative anxiety in some cases.","","alimemazine; alpha adrenergic receptor stimulating agent; antihistaminic agent; barbituric acid derivative; benzodiazepine; beta adrenergic receptor blocking agent; diazepam; flunitrazepam; hydroxyzine; morphine; neuroleptic agent; opiate; oxazepam; oxycodone; phenobarbital; triazolam; anxiety; human; priority journal; review; surgery"
"Feingold Richard; Bruestle Harry R.; Bartoletti Tony; Saroyan Allyn; Fisher John","Feingold, Richard (6701525672); Bruestle, Harry R. (57199576300); Bartoletti, Tony (8434338400); Saroyan, Allyn (6508158693); Fisher, John (57213440593)","6701525672; 57199576300; 8434338400; 6508158693; 57213440593","Verifying the secure setup of UNIX client/servers and detection of network intrusion","1996","0","","https://www.scopus.com/inward/record.uri?eid=2-s2.0-0029754078&partnerID=40&md5=d2929431e28b26a11148967e3677855c","This paper describes our technical approach to developing and delivering Unix host- and network-based security products to meet the increasing challenges in information security. Today's global `Infosphere' presents us with a networked environment that knows no geographical, national, or temporal boundaries, and no ownership, laws, or identity cards. This seamless aggregation of computers, networks, databases, applications, and the like store, transmit, and process information. This information is now recognized as an asset to governments, corporations, and individuals alike. This information must be protected from misuse. The Security Profile Inspector (SPI) performs static analyses of Unix-based clients and servers to check on their security configuration. SPI's broad range of security tests and flexible usage options support the needs of novice and expert system administrators alike. SPI's use within the Department of Energy and Department of Defense has resulted in more secure systems, less vulnerable to hostile intentions. Host-based information protection techniques and tools must also be supported by network-based capabilities. Our experience shows that a weak link in a network of clients and servers presents itself sooner or later, and can be more readily identified by dynamic intrusion detection techniques and tools. The Network Intrusion Detector (NID) is one such tool. NID is designed to monitor and analyze activity on the Ethernet broadcast Local Area Network segment and product transcripts of suspicious user connections. NID's retrospective and real-time modes have proven invaluable to security officers faced with ongoing attacks to their systems and networks.","","Data communication systems; Local area networks; Security systems; Telecommunication networks; UNIX; Ethernet; Information security; Network intrusion detector; Security profile inspector; Security of data"
"Katsikas S.; Gritzalis D.","Katsikas, S. (57200153283); Gritzalis, D. (7004051742)","57200153283; 7004051742","High level security policy guidelines","1996","2","10.3233/978-1-60750-876-2-164","https://www.scopus.com/inward/record.uri?eid=2-s2.0-84887111421&doi=10.3233%2f978-1-60750-876-2-164&partnerID=40&md5=0ab7f686b6d4fb0242a7b7e0b59e60ef","High Level Security Policies (HLSPs) are management instructions indicating how an organisation is to be run. They are the primary building blocks for any information security effort. In order to successfully install security in Information Systems operating in European Health Care Establishments (HCEs), a set of principles and guidelines must exist, which establishes both direction and management support. A HLSP should be used as a reference for a wide variety of information security and privacy activities which include establishment of user access privileges, performing risk analyses, conducting investigation of security and privacy threats, etc. It should also be considered as an essential part of the overall information policy of every HCE, which helps integrating the procedural aspects within the administrative organisation in the HCE. A HLSP refers primarily to two main actors, namely the acting subjects (patients, physicians, health informaticians, administrators, health care authorities, insurance companies, etc.) and the data objects that should be protected (medical records, communication data, etc.). The High Level Security Policy proposed herein should be fully adopted in order to be effective; moreover, conformance to its provisions should be made mandatory for all members of staff; special approval should be required when a HCE staff member wishes to take a course of action divergent from policy rules. It is worth noticing that even when a High Level Security Policy already exists, it is advisable to the management of the Health Care Establishment to periodically revisit it to see whether it should be modified or augmented. Security in Health Care Automated Information Systems can be conceptually viewed at four distinct levels of abstraction, namely generic principles (society and culture dependent); principles (administration dependent); guidelines (technology dependent) and measures (installation dependent). HLSPs address the two middle levels of abstraction, namely principles and guidelines. Hence, HLSPs depend on generic principles and must be complemented by measures. The HLSP, as it stands, defines the general approach that a Health Care Establishment should have towards implementing security. In other words, it states what should be done in order to implement security efficiently; it does not provide technical details on how to do this. These details can be found in the specialised technical guidelines developed within SEISMED. No formalised security levels have been considered in this document. Rather, the High Level Security Policy herein provides a set of mandatory conditions to ensure adequate security of personal information processed by Health Information Systems. The HLSP proposed herein was developed by a top-down approach. Specifically, principles were first derived as a result of consulting, analysing and adapting relevant similar efforts of international bodies, including - inter alia - the CEC (Directives 287 and 288), the Council of Europe, the Organisation of Economical Co-operation and Development (OECD), the US Department of Health Automated Information Systems Security Program Handbook, etc. considering what the functional model of a 'secure' HCE should be. Secondly, guidelines were developed, by detailing principles. The end result is a set of nine principles and eighty seven guidelines. The HLSP was developed in three phases. The first phase aimed at providing the reference centres with an initial draft of the HLSP, based on the results of an attitude survey among Health Care professionals in Europe the results of Risk Analysis exercises conducted at the four hospitals acting as reference centres the results of the analysis of existing and emerging data protection legislation throughout Europe relevant international literature. The second phase consisted of the evaluation of the draft HLSP produced by the first phase by Health Care professionals, Health Informaticians and management. The third phase consisted of the evaluation of the draft HLSP by all SEISMED partners and resulted in the current document. The end result is a compromise between several different (but mostly fundamentally convergent) opinions expressed by project participants or external experts; nevertheless it is felt that this has not led into major internal inconsistencies or contradictions. It is also felt that the HLSP should undergo a further, lengthy period of implementation in several HCEs across Europe, so it can be verified, amended, or modified according to everyday practice.","","Abstracting; Felt; Health care; Health insurance; Health risks; Information management; Information systems; Information use; Laws and legislation; Medical computing; Risk analysis; Risk assessment; Security systems; Automated information; Department of healths; Health care professionals; Health information systems; Levels of abstraction; Personal information; Project participants; Technical guidelines; Security of data"
"Clarkson P.; Guedes J.; Thompson R.","Clarkson, Pete (7103180312); Guedes, Jose (58585595900); Thompson, Rex (7406368348)","7103180312; 58585595900; 7406368348","On the diversification, observability, and measurement of estimation risk","1996","121","10.2307/2331387","https://www.scopus.com/inward/record.uri?eid=2-s2.0-0030542439&doi=10.2307%2f2331387&partnerID=40&md5=37c2754ffa518e732b2cb18796885394","This paper reexamines how risk return relationships are affected by investor uncertainty about the exact parameters of the joint rate of return distribution. We attempt to clarify results relating to three central issues. First, we address the issue of diversification, focusing on an APT, factor model framework. Second, we discuss the observability of estimation risk and describe research experimental designs that should encompass the existence of estimation risk and reveal it in the data. Finally, we suggest exploiting contemporaneous return observations on high and low information securities to aid in the measurement of return parameters for low information securities.","",""
"Sanderson E.; Forcht K.A.","Sanderson, Ethan (57191048990); Forcht, Karen A. (6604054533)","57191048990; 6604054533","Information security in business environments","1996","18","10.1108/09685229610114187","https://www.scopus.com/inward/record.uri?eid=2-s2.0-84986105989&doi=10.1108%2f09685229610114187&partnerID=40&md5=6c51418df04b75eabf4aa90dea7e58ca","Presents a young person’s view of the threats and security measures to deal with sensitive information in today’s constantly changing technological environment. Promotes the implementation of proactive security and warns of the problems caused by converging business markets and technologies. Discusses security policy, privacy, security logs, encryption, virus attacks, Internet concerns, firewalls and auditing. Outlines the work of the Computer Emergency Response Team and the Computer Incident Advisory Capability in the USA. © 1996, MCB UP Limited","Access control; Computer security; Data protection; Data security; Encryption; Espionage",""
"Von Solms R.","Von Solms, Rossouw (55970955300)","55970955300","Information security management: The second generation","1996","36","10.1016/0167-4048(96)88939-5","https://www.scopus.com/inward/record.uri?eid=2-s2.0-0030377647&doi=10.1016%2f0167-4048%2896%2988939-5&partnerID=40&md5=2a2456c122cd42b9eda3a632850a98a0","[No abstract available]","","Data processing; Information services; Information technology; Security of data; Information security management; Management information systems"
"Von Solms B.","Von Solms, B. (6701572289)","6701572289","Managing secure computer systems and networks","1996","2","10.1016/S0020-7101(96)01226-3","https://www.scopus.com/inward/record.uri?eid=2-s2.0-0030273150&doi=10.1016%2fS0020-7101%2896%2901226-3&partnerID=40&md5=b9f15fa6646042335ed3831b4dee72ad","No computer system or computer network can today be operated without the necessary security measures to secure and protect the electronic assets stored, processed and transmitted using such systems and networks. Very often the effort in managing such security and protection measures are totally underestimated. This paper provides an overview of the security management needed to secure and protect a typical IT system and network. Special reference is made to this management effort in healthcare systems, and the role of the information security officer is also highlighted.; No computer system or computer network can today be operated without the necessary security measures to secure and protect the electronic assets stored, processed and transmitted using such systems and networks. Very often the effort in managing such security and protection measures are totally underestimated. This paper provides an overview of the security management needed to secure and protect a typical IT system and network. Special reference is made to this management effort in healthcare systems, and the role of the information security officer is also highlighted.","","Computer networks; Computer systems; Health care; Information management; Information technology; Management information systems; Medical computing; Healthcare systems; Information security officer; Security management; computer network; computer security; computer system; conference paper; confidentiality; health care system; information processing; management; priority journal; Security of data"
"Fuller S.R.","Fuller, S.R. (57549067200)","57549067200","Government health information security standards. Beat the clock by developing security strategies now.","1997","0","","https://www.scopus.com/inward/record.uri?eid=2-s2.0-0031265198&partnerID=40&md5=fd3efff844011f308f3a225c655cf48b","[No abstract available]","","Computer Security; Confidentiality; Inservice Training; Medical Records Systems, Computerized; Organizational Policy; Planning Techniques; Professional Competence; Societies; United States; article; computer security; confidentiality; health care organization; in service training; legal aspect; medical record; organization and management; policy; professional competence; United States"
"Kärkkäinen K.H.A.; Leppänen P.A.","Kärkkäinen, Kari H. A. (35606346200); Leppänen, Pentti A. (7004001055)","35606346200; 7004001055","Linear complexity of binary golay complementary sequences","1996","5","","https://www.scopus.com/inward/record.uri?eid=2-s2.0-0030121357&partnerID=40&md5=868b3199de36e00afee3542be116211c","It is demonstrated with the Berlekamp-Massey shift-register synthesis algorithm that the linear complexity value of binary complementary sequences is at least 3/4 of the sequence length. For some sequence pairs the linear complexity value can be even 0.98 times the sequence length. In the light of these results strongly non-linear complementary sequences are considered suitable for information security applications employing the spread-spectrum (SS) technique.","Information security; Linear complexity; Non-linear sequences; Spread-spectrum technique; Spreading codes","Algorithms; Binary codes; Computational complexity; Correlation methods; Functions; Linear algebra; Security of data; Shift registers; Spread spectrum communication; Binary Golay complementary sequences; Concatenation method; Crackability; Information security; Kernels; Linear complexity; Nonlinear sequences; Spreading codes; Binary sequences"
"","","","2nd Australasian Conference on Information Security and Privacy, ACISP 1997","1997","0","","https://www.scopus.com/inward/record.uri?eid=2-s2.0-84957922143&partnerID=40&md5=ca73fb24535721f72beb3ceed9f19f70","The proceedings contain 30 papers. The special focus in this conference is on Security Models and Access Control. The topics include: Prospectives for modelling trust in information security; analysis and implementation of a formal authorisation policy design approach; an approach to dynamic domain and type enforcement; purpose-oriented access control model in object-based systems; user access domain management system; revocation of unread email in an untrusted network; security issues in asynchronous transfer mode; a method to implement a denial of service protection base; operating system and hardware support for small objects; practical memory checkers for stacks, queues and deques; using cyclotomic polynomials to construct efficient discrete logarithm cryptosystems over finite fields; a new hash function based on block cipher; new lower bounds on nonlinearity and a class of highly nonlinear functions; on the security of self-synchronous ciphers; inefficiency of variant characteristics for substitution-permutation networks with position permutations; secret sharing with reusable polynomials; a message authentication code based on latin squares; cryptanalysis of adaptive arithmetic coding encryption schemes; fast correlation attacks and multiple linear approximations; verifiable escrowed signature; democratic key escrow scheme; protection of data and delegated keys in digital distribution; new micropayment schemes based on pay words; on key agreement and conference key agreement; identity-based and self-certified key-exchange protocols and image distribution method with embedded identifier scheme for copyright protection.","",""
"Gaunt N.; Roger-France F.","Gaunt, Nick (55282831900); Roger-France, Francis (6602084726)","55282831900; 6602084726","Security of the electronic health care record - Professional and ethical implications","1996","3","10.3233/978-1-60750-871-7-10","https://www.scopus.com/inward/record.uri?eid=2-s2.0-0030344808&doi=10.3233%2f978-1-60750-871-7-10&partnerID=40&md5=99f2220b22dfd947c1df97f12b5fc47f","Many challenges face developers of secure computerised clinical systems but the technical problems are overshadowed by procedural, professional and ethical issues. The development and use of computerised systems must be controlled through compliance with standards and procedures for information security, enforced through national legislation and professional codes of conduct, if serious abuse of the data is to be avoided. Health care professionals cannot be expected to acquire working knowledge of how information systems are made secure since this is a technical and highly complex subject. However, it is essential that health care professionals understand why it is important to maintain a secure environment for the records they keep about patients and their care and how this can be organised. This is best achieved through a well structured educational programme involving all trainee and qualified health care staff, a task which should be coordinated by the national professional bodies. A management structure is needed within health care facilities that recognises the responsibility of health care professionals to keep the health care data relating to their patients secure. An arrangement is proposed that gives the most senior clinician in a health care facility the ultimate responsibility for security of health care data held in the organisation. Where appropriate, this would be delegated to a senior clinician with training and experience in information systems and their security. This 'information doctor' would, with the assistance of computer experts and health care managers, implement and monitor the organisation's information security strategy. Contracts should be developed between health care facilities and their patients, defining the limits to the use and disclosure of personal health data. Similar contracts with external agencies should also stipulate the minimum level of security to be applied to health records shared between the organisations. © 1996, The SEISMED Consortium.","","Computer Security; Confidentiality; Ethics, Professional; Europe; Humans; Medical Records Systems, Computerized; Security Measures; Health care; Information management; Information systems; Information use; Philosophical aspects; Professional aspects; Regulatory compliance; Security of data; Computerised systems; Electronic healthcare; Ethical implications; Health care professionals; Healthcare facility; Management structure; National legislation; Personal health datum; computer security; confidentiality; education; Europe; human; legal aspect; medical ethics; medical record; organization and management; review; standard; Medical computing"
